{"approval_registry_sha256":"cac2b99657803fdf05994b1d26598ca1e6d4f8a295e1dc6d92c9482178797bb3","basis_sha256":"0b0c2af06124379206d43c36a4c12fb456e3861dd335343f4382865a7aab6a05","entries":[{"approval":"missing_exact_maintainer_decision","category":"Aspect","contract_path":"categories/data/contracts/aspect-v1.json","contract_sha256":"fc14d583c50d28e4f616c2aa853acdfcebdf1a4a9626500912791a8e3baa2b08","id":"defaults.aspect.poster","kind":"poster","rules_path":"categories/data/rules/aspect-v1.json","rules_sha256":"107bf773692b5794e58f527d49769e5381e1c83234924b915b3586c33816860f","version":"1.0.0"},{"approval":"missing_exact_maintainer_decision","category":"AudioLanguage","contract_path":"categories/data/contracts/audiolanguage-v1.json","contract_sha256":"bb3c4cb548bcf2cb1f5c4d5a0d1b310ef55509fa99dceed6c835bd8ddbc8072c","id":"defaults.audiolanguage.poster","kind":"poster","rules_path":"categories/data/rules/audiolanguage-v1.json","rules_sha256":"76648f8cac0e2e6305afa802cded8e953cc17b54a1e2e1cc4733f662f18306fe","version":"1.0.0"},{"approval":"missing_exact_maintainer_decision","category":"Awards","contract_path":"categories/data/contracts/awards-v1.json","contract_sha256":"7c0dd7e17e0c2053548d168359f3e6a676412ac8864577c191851013b407b1b9","id":"defaults.awards.poster","kind":"poster","rules_path":"categories/data/rules/awards-v1.json","rules_sha256":"3c96ef1d868785952ee296fe366d4b5982fece8cfa5c6ea668d4710f00ec6ece","version":"1.0.0"},{"approval":"missing_exact_maintainer_decision","category":"Based","contract_path":"categories/data/contracts/based-v1.json","contract_sha256":"2fbcdbcfa7ead20213143fecfff7a39ab5ef3b86214f54eaf67225f9cc2f5103","id":"defaults.based.poster","kind":"poster","rules_path":"categories/data/rules/based-v1.json","rules_sha256":"a4f9ea7733e796236b0e14c97048f1f7152c1f34bf2d5d625d9160920124ca05","version":"1.0.0"},{"approval":"missing_exact_maintainer_decision","category":"Chart","contract_path":"categories/data/contracts/chart-v1.json","contract_sha256":"31e51f40fedc6c7b713bc8778c37fe4f2261b6190e7ff68b36088dbb08f0141f","id":"defaults.chart.poster","kind":"poster","rules_path":"categories/data/rules/chart-v1.json","rules_sha256":"f73656528575197bc7316e1e815b625a8ff04a46318e9e0cb0b0aa9f6d6f8de8","version":"1.0.0"},{"approval":"missing_exact_maintainer_decision","category":"ContentRating","contract_path":"categories/data/contracts/contentrating-v1.json","contract_sha256":"fb4494c27910daf618ae9c58e7df8a867a0836e4a1b40f7c64b46cff6ffbaef3","id":"defaults.contentrating.poster","kind":"poster","rules_path":"categories/data/rules/contentrating-v1.json","rules_sha256":"83377fe90d2c66045d478b967bd4e8a1d5117fc4bf0066aa0ebbf807a416334d","version":"1.0.0"},{"approval":"missing_exact_maintainer_decision","category":"Country","contract_path":"categories/data/contracts/country-v1.json","contract_sha256":"bcfc3498f96b8412b016c1c93a600448fe591c485a5994f52798f14bb3ec99cd","id":"defaults.country.poster","kind":"poster","rules_path":"categories/data/rules/country-v1.json","rules_sha256":"3b442f0e58acc17202d6e08cdb810c6fbabdbc6fe86c554f6b032ada7e1f8f4b","version":"1.0.0"},{"approval":"missing_exact_maintainer_decision","category":"Decade","contract_path":"categories/data/contracts/decade-v1.json","contract_sha256":"e215dc4c5a41ea1fb51415f9ddf841033a066b2e3472ea648e28bffb8dedea8c","id":"defaults.decade.poster","kind":"poster","rules_path":"categories/data/rules/decade-v1.json","rules_sha256":"deedb60dfd6585ea297ffc3f9b31dac35b5d18110051f3d34caec993f3c73571","version":"1.0.0"},{"approval":"missing_exact_maintainer_decision","category":"Franchise","contract_path":"categories/data/contracts/franchise-v1.json","contract_sha256":"3f95c0f4c80df9aba2934c5e1e4e50065bdd894e9202ec2f0a3aa5f80d19bf1b","id":"defaults.franchise.poster","kind":"poster","rules_path":"categories/data/rules/franchise-v1.json","rules_sha256":"30fcfcc089b4adf1fd5e67d2357cb6637e26cfc424e6d9434f25ab5dc0f7c0a0","version":"1.0.0"},{"approval":"missing_exact_maintainer_decision","category":"Genre","contract_path":"categories/data/contracts/genre-v1.json","contract_sha256":"ad2bb267b9fb0b0452fd92da9630f323f9ca86c80c169b930fbf8387d96a778a","id":"defaults.genre.poster","kind":"poster","rules_path":"categories/data/rules/genre-v1.json","rules_sha256":"13186ecaddf49c06741ddf70501ecf5985e0c07e3e71fdc99dbbd6d714deefd7","version":"1.0.0"},{"approval":"missing_exact_maintainer_decision","category":"Network","contract_path":"categories/data/contracts/network-v1.json","contract_sha256":"fd090570f6b7976e064660dec91f9f8207980cbb9e6e7d6e2aeafa3cc7b05b0c","id":"defaults.network.poster","kind":"poster","rules_path":"categories/data/rules/network-v1.json","rules_sha256":"9ec1d48a4a39d93b3f1e00b43c41ad4c5fa5db574d2add3048ceebae90e90dab","version":"1.0.0"},{"approval":"missing_exact_maintainer_decision","category":"Playlist","contract_path":"playlist/contract-v1.json","contract_sha256":"5047d834ecd3f8e5a0ed76ae24760b6947ae6b83e95198ce602e1715e445016b","id":"defaults.playlist.poster","kind":"poster","rules_path":"categories/data/rules/playlist-v1.json","rules_sha256":"f8dabde54206a85aee1a2eb769dc066d0de47b7792bdd7a34c22bde145590932","version":"1.0.0"},{"approval":"missing_exact_maintainer_decision","category":"Resolution","contract_path":"categories/data/contracts/resolution-v1.json","contract_sha256":"4475c9bb450380395a2a2e982fcf72cb33f8453fe3d4665ea8a171e9f6570865","id":"defaults.resolution.poster","kind":"poster","rules_path":"categories/data/rules/resolution-v1.json","rules_sha256":"d5fe33a37e12cc75a3ab586e92311fe4546b32d168ab1710550c44f012a35298","version":"1.0.0"},{"approval":"missing_exact_maintainer_decision","category":"Seasonal","contract_path":"categories/data/contracts/seasonal-v1.json","contract_sha256":"1124fecbde06c2c78c8fba9772d16de65d9cc70ae0d29a8f203b931f2e2507c7","id":"defaults.seasonal.poster","kind":"poster","rules_path":"categories/data/rules/seasonal-v1.json","rules_sha256":"d5abaf859796e02c4c4ce6ad7caddae9f5c23c5d7dbc8f60625ca0b43791cbca","version":"1.0.0"},{"approval":"missing_exact_maintainer_decision","category":"Separators","contract_path":"categories/data/contracts/separators-v1.json","contract_sha256":"f846c148539eebf0bcdad47cb9b2c2e68c3e7517c8566b12acf40dc7426e3331","id":"defaults.separators.poster","kind":"poster","rules_path":"categories/data/rules/separators-v1.json","rules_sha256":"3fe151a12839e3dfb14fe3185bd32d4429c672200aa5ac67a15d43f7cefb8206","version":"1.0.0"},{"approval":"missing_exact_maintainer_decision","category":"Streaming","contract_path":"categories/data/contracts/streaming-v1.json","contract_sha256":"89869d979fa4236590f9195eb216838feab1a63662fb35a78cc49a9c863566de","id":"defaults.streaming.poster","kind":"poster","rules_path":"categories/data/rules/streaming-v1.json","rules_sha256":"8dbacbad75d63f508a7e9b4287a68f3adbf8619c59f3dfafadf277ab76eb6ab4","version":"1.0.0"},{"approval":"missing_exact_maintainer_decision","category":"Studio","contract_path":"categories/data/contracts/studio-v1.json","contract_sha256":"d675c3b036fc8a44741552d8c8cf32587b986aa3302343f666da510ea83e35fd","id":"defaults.studio.poster","kind":"poster","rules_path":"categories/data/rules/studio-v1.json","rules_sha256":"b6e558af362322977052ac60d0c71eea38bd456627d25bc295c48287f2e39ca9","version":"1.0.0"},{"approval":"missing_exact_maintainer_decision","category":"SubtitleLanguage","contract_path":"categories/data/contracts/subtitlelanguage-v1.json","contract_sha256":"dc899a0611b93ea461fb5af6ef79abf2fa6d7fab27c41bf1fb17c5b83bce9e45","id":"defaults.subtitlelanguage.poster","kind":"poster","rules_path":"categories/data/rules/subtitlelanguage-v1.json","rules_sha256":"ccd4ccda98955292a4531a18e599622970ae907323d532a110c5d1b6b95adfdd","version":"1.0.0"},{"approval":"missing_exact_maintainer_decision","category":"Universe","contract_path":"categories/data/contracts/universe-v1.json","contract_sha256":"e85fd297c7e3d537134de23221919d20ff7a2500ca3409c650d8448962b6809c","id":"defaults.universe.poster","kind":"poster","rules_path":"categories/data/rules/universe-v1.json","rules_sha256":"08c9c9a55ec0aca9aef8af4ff2bcea3013eb4e2eb5c6bd8fc9ef0fd1ff782aa3","version":"1.0.0"},{"approval":"missing_exact_maintainer_decision","category":"VideoFormat","contract_path":"categories/data/contracts/videoformat-v1.json","contract_sha256":"c872e26f91424b8eb87f7f48bac8d741eac5d479f6a61dadec01951e06c97c4f","id":"defaults.videoformat.poster","kind":"poster","rules_path":"categories/data/rules/videoformat-v1.json","rules_sha256":"e10d8ce292153156962292cce0187c06575e4f8b36a2e00174ee665ad207f962","version":"1.0.0"},{"approval":"missing_exact_maintainer_decision","category":"Year","contract_path":"categories/data/contracts/year-v1.json","contract_sha256":"9536beb851ef832f64493e7467f544db9ad77b07234f9f5dd53613bdb6fc5926","id":"defaults.year.poster","kind":"poster","rules_path":"categories/data/rules/year-v1.json","rules_sha256":"0b7e5b818c9c332f9571a2997438332318ae9c9a20fba6c15f474b4c09c3d7c8","version":"1.0.0"},{"approval":"missing_exact_maintainer_decision","category":"Overlays","contract_path":"categories/data/contracts/overlays-v1.json","contract_sha256":"b79d5aa935a349137718109adb56dbc4a67b7bc760fc3917eccba595cb5fa551","id":"defaults.overlays.overlay","kind":"overlay","rules_path":"categories/data/rules/overlays-v1.json","rules_sha256":"b3d25b2c4286ad7d7a0afa0c6710218afd38952863bdea1a5a26e26a324ec0ae","version":"1.0.0"}],"id":"defaults-category-contracts","kind":"category-contract-implementation","schema_version":1,"version":"1.0.0"}